{
  "$ref": "#/definitions/ads",
  "definitions": {
    "ads": {
      "type": "object",
      "properties": {
        "id": {
          "type": "string"
        },
        "title": {
          "type": "string"
        },
        "slot": {
          "type": "string",
          "enum": [
            "sidebar",
            "in-article",
            "top-header"
          ]
        },
        "imageUrl": {
          "type": "string"
        },
        "targetUrl": {
          "type": "string",
          "format": "uri"
        },
        "active": {
          "type": "boolean",
          "default": true
        },
        "startDate": {
          "type": "string"
        },
        "endDate": {
          "type": "string"
        },
        "priority": {
          "type": "number",
          "default": 1
        },
        "rtbBlockId": {
          "type": "string"
        },
        "$schema": {
          "type": "string"
        }
      },
      "required": [
        "id",
        "title",
        "slot",
        "imageUrl",
        "targetUrl"
      ],
      "additionalProperties": false
    }
  },
  "$schema": "http://json-schema.org/draft-07/schema#"
}