{
  "priority": 1,
  "active": true,
  "endDate": "2027-05-27",
  "startDate": "2026-10-20",
  "imageUrl": "https://psv4.vkuserphoto.ru/s/v1/d2/HeNf3kw5ZS89jE0cDfzRkAZdg_fqzFmc5b6zLcCRzqvSfq9vbCsC5yQhxBwqrh6iwhMMzBX7uCRhpvGVtIcltgiMHtH5CK647ikU0bPpGPIzLY-ba3-XljLRkx8oxK3pr7lKfI_NkYu8/ads4.jpg",
  "title": "Тут может быть ваша реклама.",
  "id": "fast-edge-cdn-promo",
  "slot": "in-article",
  "targetUrl": "https://hallizar.ru/blog/2026-10-20-%D1%81%D0%BE%D1%82%D1%80%D1%83%D0%B4%D0%BD%D0%B8%D1%87%D0%B5%D1%81%D1%82%D0%B2%D0%BE"
}
